{
  "selection": "orders_base.amount",
  "selection_id": "column:orders_base.amount",
  "related_ids": [
    "column:customer_totals.total_amount",
    "column:customers_report.customer_lifetime_value"
  ],
  "traversed_edges": [
    {
      "kind": "derives_from",
      "source_id": "column:customer_totals.total_amount",
      "target_id": "column:orders_base.amount",
      "label": "derives_from",
      "confidence": "high",
      "match_status": null,
      "evidence": [
        {
          "file": "customer_totals.sql",
          "location": null,
          "expression": "orders_base.amount",
          "confidence": "medium"
        }
      ],
      "derivation": {
        "status": "complete",
        "confidence": "high",
        "source": "sqlglot",
        "errors": []
      }
    },
    {
      "kind": "derives_from",
      "source_id": "column:customers_report.customer_lifetime_value",
      "target_id": "column:customer_totals.total_amount",
      "label": "derives_from",
      "confidence": "high",
      "match_status": null,
      "evidence": [
        {
          "file": "customers_report.sql",
          "location": null,
          "expression": "customer_totals.total_amount",
          "confidence": "medium"
        }
      ],
      "derivation": {
        "status": "complete",
        "confidence": "high",
        "source": "sqlglot",
        "errors": []
      }
    }
  ],
  "warnings": [
    {
      "code": "warehouse_bind_unresolved",
      "message": "column:orders_base.amount parent table could not be uniquely bound to warehouse metadata (match_status=unresolved)",
      "location": null,
      "subject_id": "column:orders_base.amount"
    }
  ],
  "derivation": [
    {
      "id": "column:customer_totals.total_amount",
      "status": "complete",
      "confidence": "high"
    },
    {
      "id": "column:customers_report.customer_lifetime_value",
      "status": "complete",
      "confidence": "high"
    },
    {
      "edge": "column:customer_totals.total_amount->column:orders_base.amount",
      "status": "complete",
      "confidence": "high"
    },
    {
      "edge": "column:customers_report.customer_lifetime_value->column:customer_totals.total_amount",
      "status": "complete",
      "confidence": "high"
    }
  ]
}
